{
  "version": "2.1",
  "upload_id": "20260909-fixture",
  "created_at": "2026-09-09T00:00:00Z",
  "completed_at": "2026-09-09T00:01:00Z",
  "source_path": "/tmp/src",
  "hostname": "fixture-host",
  "bucket": "example-bucket",
  "prefix": "backups",
  "region": "us-east-1",
  "total_files": 2,
  "total_bytes": 300,
  "total_chunks": 1,
  "shard_count": 1,
  "compression_type": "zstd",
  "compression_level": 3,
  "compression_ratio": 0.5,
  "checksum_algorithm": "sha256",
  "format_features": [
    "frames"
  ],
  "files": [
    {
      "path": "data/a.txt",
      "size": 100,
      "mod_time": "2023-11-14T22:13:20Z",
      "chunk_id": 0,
      "shard_id": 0,
      "s3_key": "backups/uploads/20260909-fixture/shard-0/chunk-0.tar.zst",
      "archive_offset": 512,
      "checksum": "e3b0c44298fc1c149afbf4c8996fb92427ae41e4649b934ca495991b7852b855"
    },
    {
      "path": "data/b.txt",
      "size": 200,
      "mod_time": "2023-11-14T22:13:20Z",
      "chunk_id": 0,
      "shard_id": 0,
      "s3_key": "backups/uploads/20260909-fixture/shard-0/chunk-0.tar.zst",
      "archive_offset": 66048,
      "checksum": "e3b0c44298fc1c149afbf4c8996fb92427ae41e4649b934ca495991b7852b855"
    }
  ],
  "chunks": [
    {
      "id": 0,
      "shard_id": 0,
      "s3_key": "backups/uploads/20260909-fixture/shard-0/chunk-0.tar.zst",
      "file_count": 2,
      "file_paths": [
        "data/a.txt",
        "data/b.txt"
      ],
      "uncompressed_size": 300,
      "compressed_size": 120,
      "created_at": "2023-11-14T22:13:20Z",
      "uploaded_at": "2023-11-14T22:14:20Z",
      "checksum": "abc",
      "frames": [
        {
          "compressed_offset": 0,
          "compressed_size": 60,
          "uncompressed_offset": 0,
          "uncompressed_size": 65536
        },
        {
          "compressed_offset": 60,
          "compressed_size": 60,
          "uncompressed_offset": 65536,
          "uncompressed_size": 66048
        }
      ]
    }
  ],
  "shards": [
    {
      "id": 0,
      "prefix": "backups/uploads/20260909-fixture/shard-0",
      "chunk_count": 1,
      "file_count": 2,
      "uncompressed_size": 300,
      "compressed_size": 120,
      "chunk_keys": [
        "backups/uploads/20260909-fixture/shard-0/chunk-0.tar.zst"
      ]
    }
  ]
}
